question;answer
What is 'JunHu'?;Dish%false|Weapon%false|Nationality%false|Subculture%true
What period is narrated in the 'Chronicles of the Three Kingdoms'?;Present Time%false|5400-5000 B.C.%false|0-300 A.D.%true|300-800 A.D.%false
What is the name of the main character of the novel 'Dream in the Red Chamber'?;Bǎo Yù%true|Wèi Wúxiàn%false|Sūn Wùkōng%false|Sūn Zǐ%false
Who wrote the novel 'River Backwaters' (14th A.D.) ?;Shi Nai-Yan%false|Luo Guan-Zhong%false|Wu-Yu%false|Guo Qiang%false|Subject of discussion%true
What did Wu-Sung do when he saw the little finger of the Buddha?;Composed a hymn%false|Prayed%false|Peed on the little finger%true|Thought about the impermanence of being%false
